{
  "protocol_version": 1,
  "proof_id": "x",
  "issuer": "x",
  "subject": "x",
  "audience": "cliptown",
  "device_id": "x",
  "challenge_id": "x",
  "action": "enroll_device",
  "issued_at": "2026-01-01T00:00:00Z",
  "expires_at": "2026-01-01T00:00:00Z",
  "signing_key_id": "x",
  "signature": "xxxxxxxxxxxxxxxxxxxxxxxxxxxxxxxxxxxxxxxxxxx"
}
